{
  "schema_version": 1,
  "packet_id": "ci-11576865-Quick-Automatic-Hardsub-Encoder-37120353580-1",
  "source_repository": "11576865/Quick-Automatic-Hardsub-Encoder",
  "packet_sha256": "8f421309dbc47b66a43b97bc955bad89840e5158f21db9d56634986efab4ef05",
  "triage_status": "needs-review",
  "record_type": "ci_failure",
  "routing_hints": [
    "architecture",
    "interface-grammar",
    "operations",
    "red-reason",
    "reliability"
  ],
  "red_reason": {
    "category": "runtime-smoke",
    "confidence": 0.68,
    "needs_review": true,
    "signals": [
      "workflow:Windows local smoke"
    ],
    "matched_rules": [
      "runtime-smoke"
    ]
  },
  "related_records": [
    "REL.CAPABILITY_PROVEN_BY_OUTPUT",
    "ARCH.STRUCTURED_NATIVE_BRIDGE"
  ],
  "created_at": "2026-10-03T11:40:01+00:00",
  "triaged_at": "2026-10-03T11:40:30+00:00"
}
