{
  "schema_version": 1,
  "packet_id": "ci-11576865-Quick-Automatic-Hardsub-Encoder-37136615969-1",
  "source_repository": "11576865/Quick-Automatic-Hardsub-Encoder",
  "packet_sha256": "45b8fc59bd8982cf704f67915ff4dd0620d47a838b55797899eb80e09b900011",
  "triage_status": "needs-review",
  "record_type": "ci_failure",
  "routing_hints": [
    "architecture",
    "interface-grammar",
    "operations",
    "red-reason",
    "reliability"
  ],
  "red_reason": {
    "category": "unknown",
    "confidence": 0.0,
    "needs_review": true,
    "signals": [],
    "matched_rules": []
  },
  "related_records": [],
  "created_at": "2026-10-03T16:23:26+00:00",
  "triaged_at": "2026-10-03T21:15:16+00:00"
}
