{
  "schema_version": 1,
  "packet_id": "ci-11576865-MKV-Fast-Muxer-37018860340-1",
  "source_repository": "11576865/MKV-Fast-Muxer",
  "packet_sha256": "586a018099eaeb11926613cb26d35a28f85ea93b20097a0084460549b70306f5",
  "triage_status": "auto-classified",
  "record_type": "ci_failure",
  "routing_hints": [
    "interface-grammar",
    "operations",
    "red-reason",
    "reliability"
  ],
  "red_reason": {
    "category": "unit-test",
    "confidence": 0.92,
    "needs_review": false,
    "signals": [
      "step:Unit tests"
    ],
    "matched_rules": [
      "unit"
    ]
  },
  "related_records": [],
  "created_at": "2026-10-02T14:19:05+00:00",
  "triaged_at": "2026-10-02T17:53:01+00:00"
}
