{
  "schema_version": 1,
  "packet_id": "ci-11576865-ASS-Workbench-Android-37319913065-1",
  "source_repository": "11576865/ASS-Workbench-Android",
  "packet_sha256": "ce667d02a601176e22949af5d1908117db71d2d62d0e33f65f182056a81318bb",
  "triage_status": "needs-review",
  "record_type": "ci_failure",
  "routing_hints": [
    "interface-grammar",
    "operations",
    "red-reason",
    "reliability"
  ],
  "red_reason": {
    "category": "unknown",
    "confidence": 0.0,
    "needs_review": true,
    "signals": [],
    "matched_rules": []
  },
  "related_records": [],
  "created_at": "2026-10-05T14:04:21+00:00",
  "triaged_at": "2026-10-07T06:01:03+00:00"
}
