{
  "schema_version": 1,
  "packet_id": "ci-11576865-ASS-Workbench-Android-37182132523-1",
  "source_repository": "11576865/ASS-Workbench-Android",
  "packet_sha256": "5c62d39e0f6b5e2842efa7b8b5e755f3a668aa24979e53fcb351a6f577863bd6",
  "triage_status": "auto-classified",
  "record_type": "ci_failure",
  "routing_hints": [
    "interface-grammar",
    "operations",
    "red-reason",
    "reliability"
  ],
  "red_reason": {
    "category": "packaging",
    "confidence": 0.92,
    "needs_review": false,
    "signals": [
      "step:Build ASS Workbench production Fontconfig APK"
    ],
    "matched_rules": [
      "packaging"
    ]
  },
  "related_records": [
    "BUG.ASS.RELEASE_PATH_ASYMMETRY",
    "REL.RELEASE_PATH_PARITY"
  ],
  "created_at": "2026-10-04T06:23:56+00:00",
  "triaged_at": "2026-10-04T07:43:37+00:00"
}
