{
  "schema_version": 1,
  "packet_id": "ci-11576865-ASS-Workbench-Android-37184837813-1",
  "source_repository": "11576865/ASS-Workbench-Android",
  "packet_sha256": "1e6b824346ba844740a39351328652673696c60e37eba1fd5f97c3c83503ba26",
  "triage_status": "auto-classified",
  "record_type": "ci_failure",
  "routing_hints": [
    "interface-grammar",
    "operations",
    "red-reason",
    "reliability"
  ],
  "red_reason": {
    "category": "unit-test",
    "confidence": 0.92,
    "needs_review": false,
    "signals": [
      "step:Unit tests"
    ],
    "matched_rules": [
      "unit"
    ]
  },
  "related_records": [],
  "created_at": "2026-10-04T07:09:49+00:00",
  "triaged_at": "2026-10-04T07:43:37+00:00"
}
