{
  "schema_version": 1,
  "packet_id": "ci-11576865-Quick-Automatic-Hardsub-Encoder-37121139872-1",
  "source_repository": "11576865/Quick-Automatic-Hardsub-Encoder",
  "packet_sha256": "a1f185cde16b81d00d100d8103b8ba03be9d34c349ead9960b9576488f5ce0a0",
  "triage_status": "auto-classified",
  "record_type": "ci_failure",
  "routing_hints": [
    "architecture",
    "interface-grammar",
    "operations",
    "red-reason",
    "reliability"
  ],
  "red_reason": {
    "category": "runtime-smoke",
    "confidence": 0.92,
    "needs_review": false,
    "signals": [
      "step:Smoke Windows localhost bridge",
      "workflow:Windows local smoke"
    ],
    "matched_rules": [
      "runtime-smoke"
    ]
  },
  "related_records": [
    "REL.CAPABILITY_PROVEN_BY_OUTPUT",
    "ARCH.STRUCTURED_NATIVE_BRIDGE"
  ],
  "created_at": "2026-10-03T11:56:35+00:00",
  "triaged_at": "2026-10-03T16:18:15+00:00"
}
