{
  "schema_version": 1,
  "packet_id": "ci-11576865-ASS-Workbench-Android-37315034088-1",
  "source_repository": "11576865/ASS-Workbench-Android",
  "packet_sha256": "8da20afe16c39b37811e5dd576b01c593fc242bd17f44bbe2d201564649bf868",
  "triage_status": "needs-review",
  "record_type": "ci_failure",
  "routing_hints": [
    "interface-grammar",
    "operations",
    "red-reason",
    "reliability"
  ],
  "red_reason": {
    "category": "runtime-smoke",
    "confidence": 0.68,
    "needs_review": true,
    "signals": [
      "workflow:Fontconfig renderer native probe"
    ],
    "matched_rules": [
      "runtime-smoke"
    ]
  },
  "related_records": [
    "REL.CAPABILITY_PROVEN_BY_OUTPUT",
    "TEST.RENDERED_EFFECT_DIFFERENTIAL"
  ],
  "created_at": "2026-10-05T13:13:12+00:00",
  "triaged_at": "2026-10-07T06:01:03+00:00"
}
