{
  "schema_version": 1,
  "packet_id": "ci-11576865-Quick-Automatic-Hardsub-Encoder-37177597586-1",
  "source_repository": "11576865/Quick-Automatic-Hardsub-Encoder",
  "packet_sha256": "11e071ddd1f2ff1e6a99555572ec9ecf35c25effee97e181abac3272533770b8",
  "triage_status": "auto-classified",
  "record_type": "ci_failure",
  "routing_hints": [
    "architecture",
    "interface-grammar",
    "operations",
    "red-reason",
    "reliability"
  ],
  "red_reason": {
    "category": "integration-test",
    "confidence": 0.92,
    "needs_review": false,
    "signals": [
      "step:Run FFMPEG_INTEGRATION=1 node --test src/av1-alac-acceptance.integration.test.mjs"
    ],
    "matched_rules": [
      "integration"
    ]
  },
  "related_records": [],
  "created_at": "2026-10-04T04:39:42+00:00",
  "triaged_at": "2026-10-04T05:53:58+00:00"
}
